{"case_id":"F3-short","blind_run_id":"RUN-H2C7","detected_issue_ids":[],"false_no_material_issue_ids":[],"false_duplicate_issue_ids":[],"audit_valid":true,"failure_trace_specificity":1.0,"grading_notes":["The gold contract contains no issue IDs, so no terminal finding can be credited as a detected gold issue or classified as a false closure.","The best decision-relevant finding concretely specifies a case-linked precondition, event, observable failure, causal mechanism, and falsifier.","The artifact raises speculative material objections despite the closed-world contract allowing closure with no material objection."]}