{"case_id":"F2-noisy","blind_run_id":"RUN-X9D4","detected_issue_ids":["I-F2-DUPLICATE","CRIT-F2-SECOND-ORDER"],"false_no_material_issue_ids":[],"false_duplicate_issue_ids":[],"audit_valid":true,"failure_trace_specificity":1.0,"grading_notes":["FINDING-2 concretely identifies the initial duplicate defect and binds P1's changed STORE_UNAVAILABLE handler to the new observable risk of suppressing a concern about the new behavior as a duplicate of the old behavior.","FINDING-2 provides a concrete, case-linked precondition, event, observable failure, causal mechanism, and falsifier.","No gold issue was explicitly suppressed as DUPLICATE or closed as no-material; all host-audit booleans and terminal audit_valid are true."]}