{"case_id":"F2-short","blind_run_id":"RUN-B4K9","detected_issue_ids":["I-F2-DUPLICATE","CRIT-F2-SECOND-ORDER"],"false_no_material_issue_ids":[],"false_duplicate_issue_ids":[],"audit_valid":true,"failure_trace_specificity":1.0,"grading_notes":["FINDING-1 concretely identifies the initial materiality defect: distinct observable impacts sharing an axis and mechanism ID are normalized into one finding.","FINDING-2 binds the supplied handler revision to changed operational effects—provisional publication, manual triage, and no retry—and identifies their erroneous collapse as the observable failure.","FINDING-2 supplies concrete, case-linked precondition, event, observable failure, mechanism, and falsifier.","No gold issue is explicitly suppressed as DUPLICATE or closed as no-material."]}