{"case_id":"F2-noisy","blind_run_id":"RUN-C9P4","detected_issue_ids":[],"false_no_material_issue_ids":[],"false_duplicate_issue_ids":[],"audit_valid":true,"failure_trace_specificity":0.0,"grading_notes":["No terminal findings were provided, so neither the initial issue nor the distinct post-revision critical issue was detected.","The missing critical issue is a miss, not an explicit DUPLICATE or no-material closure."]}