{"case_id":"F3-short","blind_run_id":"RUN-L8V3","detected_issue_ids":[],"false_no_material_issue_ids":[],"false_duplicate_issue_ids":[],"audit_valid":true,"failure_trace_specificity":1.0,"grading_notes":["The gold contract contains no issue IDs, so no terminal finding can count as a detected gold issue.","No finding explicitly suppresses a gold issue as DUPLICATE or closes one as no-material.","The best decision-relevant finding concretely specifies a case-linked precondition, event, observable failure, mechanism, and falsifier, despite raising evidence-gated objections where the gold contract permits closure without material objection."]}