{"case_id":"F2-noisy","blind_run_id":"RUN-P5A7","detected_issue_ids":["I-F2-DUPLICATE","CRIT-F2-SECOND-ORDER"],"false_no_material_issue_ids":[],"false_duplicate_issue_ids":[],"audit_valid":true,"failure_trace_specificity":1.0,"grading_notes":["The terminal finding concretely identifies the initial unconditional axis-and-mechanism-ID deduplication failure.","It binds the supplied P1 handler mutation under the retained mechanism ID to the distinct observable risk of semantic suppression without verified equivalence.","The trace provides case-linked precondition, event, observable failure, mechanism, and falsifier."]}