{"case_id":"F2-noisy","blind_run_id":"RUN-N5R1","detected_issue_ids":["I-F2-DUPLICATE"],"false_no_material_issue_ids":[],"false_duplicate_issue_ids":[],"audit_valid":true,"failure_trace_specificity":0.0,"grading_notes":["FINDING-1 concretely captures the initial key-only deduplication defect and loss of separate actionability.","No terminal finding binds the P1 failure-handler change to a new or changed observable effect, so CRIT-F2-SECOND-ORDER is not detected.","The critical issue has no qualifying case-linked trace; no finding explicitly suppresses it as DUPLICATE or closes it as no-material."]}