{"case_id":"F2-short","blind_run_id":"RUN-Q7M2","detected_issue_ids":["I-F2-DUPLICATE","CRIT-F2-SECOND-ORDER"],"false_no_material_issue_ids":[],"false_duplicate_issue_ids":[],"audit_valid":true,"failure_trace_specificity":1.0,"grading_notes":["FINDING-1 concretely binds P1's changed failure handler to the changed observable effect and explains how retained mechanism identity could suppress it as a duplicate.","The best detecting trace provides concrete, case-linked precondition, event, observable failure, mechanism, and falsifier.","No distinct gold issue was explicitly closed as no-material or suppressed as DUPLICATE."]}